### ISSUE TITLE
DNS check does incorrect PTR lookups for IPv6

### ISSUE THREAD

**Issue by esproul** [circonus-labs/reconnoiter#517]
If I create a DNS check using the PTR record type, and enter an IPv6 address, the DNS module does not construct a valid `ip6.arpa.` query.  Consider these tcpdumps, the first from a broker trying to execute a PTR check for `2607:f8b0:4004:802::2004`, the second from `dig @8.8.4.4 -x 2607:f8b0:4004:802::2004` on the broker's host OS:

broker:
```
14:46:00.728043 IP x.x.x.x.50877 > 8.8.4.4.domain: 9346+ [1au] PTR? 2607:f8b0:4004:802::2004. (53)
14:46:00.739805 IP 8.8.4.4.domain > x.x.x.x.50877: 9346 NXDomain 0/1/1 (128)
```

dig:
```
14:48:03.308405 IP x.x.x.x.37313 > 8.8.4.4.domain: 16813+ [1au] PTR? 4.0.0.2.0.0.0.0.0.0.0.0.0.0.0.0.2.0.8.0.4.0.0.4.0.b.8.f.7.0.6.2.ip6.arpa. (101)
14:48:03.319944 IP 8.8.4.4.domain > x.x.x.x.37313: 16813 1/0/1 PTR iad23s58-in-x04.1e100.net. (140)
```

A cursory glance at https://github.com/circonus-labs/reconnoiter/blob/master/src/modules/dns.c shows that we anticipate doing reverse lookups on IPv6, but `dns_interpolate_inaddr_arpa()` seems to only consider dot-delimited strings (i.e., IPv4 only).

**Comment by postwait** [comment]
Can you provide the check XML

**Comment by esproul** [comment]
Sorry, didn't see a notification of your request.  Here is the check config as stored on the broker:

```xml
<?xml version="1.0" encoding="utf8"?>
<check xmlns:reverse="noit://module/reverse" xmlns:custom="noit://module/custom" xmlns:histogram="noit://module/histogram" uuid="03c15e9b-321f-486b-83d8-94bdd84b899d" target="8.8.4.4" period="60000" timeout="10000" name="c_406_70975::dns" seq="17635" filterset="filterset_152" module="dns">
  <config xmlns:reverse="noit://module/reverse">
    <ctype>IN</ctype>
    <rtype>PTR</rtype>
    <query>2607:f8b0:4004:802::2004</query>
    <reverse:secret_key>a34ca73c-377c-43a0-b85a-a6ccad2062ea</reverse:secret_key>
  </config>
</check>
```

**Comment by esproul** [comment]
This is not an issue with Reconnoiter. It is instead an issue with the Circonus UI's way of configuring DNS checks.
